{"$schema":"https://json-schema.org/draft/2020-12/schema","$id":"https://spirosearch.local/schemas/run-compatibility.schema.json","title":"run-compatibility","type":"object","additionalProperties":false,"required":["schema_version","project_id","source_run_id","target_run_id","comparison_policy_version","status","reason_codes","dimensions"],"properties":{"schema_version":{"const":"v20.run_compatibility.v1"},"project_id":{"type":"string","minLength":1},"source_run_id":{"type":"string","minLength":1},"target_run_id":{"type":"string","minLength":1},"comparison_policy_version":{"type":"string","minLength":1},"status":{"enum":["comparable","partially_comparable","non_comparable"]},"reason_codes":{"type":"array","items":{"type":"string"},"uniqueItems":true},"dimensions":{"type":"array","items":{"$schema":"https://json-schema.org/draft/2020-12/schema","$id":"https://spirosearch.local/schemas/RunCompatibilityDimension.schema.json","title":"RunCompatibilityDimension","type":"object","additionalProperties":false,"required":["dimension","status","reason_codes"],"properties":{"dimension":{"type":"string","minLength":1},"status":{"enum":["comparable","non_comparable"]},"reason_codes":{"type":"array","items":{"type":"string"},"uniqueItems":true}}}}}}
