{"schema_version":"v20.run_compatibility.v1","project_id":"project-v20-fixture","source_run_id":"run-001","target_run_id":"run-002","comparison_policy_version":"v20.run_compatibility_policy.v1","status":"partially_comparable","reason_codes":["DATASET_SNAPSHOT_CHANGED"],"dimensions":[{"dimension":"screening_status","status":"comparable","reason_codes":[]},{"dimension":"evidence_ids","status":"comparable","reason_codes":[]},{"dimension":"blockers","status":"comparable","reason_codes":[]},{"dimension":"score_rank","status":"non_comparable","reason_codes":["DATASET_SNAPSHOT_CHANGED"]}]}
